{
  "$schema": "https://json-schema.org/draft/2020-12/schema",
  "$id": "https://github.com/Azure/Azure-Sentinel/blob/master/Tools/Sentinel-Content-Forge-Accelerator/schemas/generation-evidence.schema.json",
  "title": "Sentinel Content Forge generation evidence",
  "description": "Traceability from each generated artifact to user-provided source fields and selected Microsoft reference paths.",
  "type": "object",
  "additionalProperties": false,
  "required": [
    "schemaVersion",
    "contentRequestPath",
    "classificationPath",
    "artifacts"
  ],
  "properties": {
    "schemaVersion": {
      "const": 1
    },
    "contentRequestPath": {
      "type": "string",
      "minLength": 1
    },
    "classificationPath": {
      "type": "string",
      "minLength": 1
    },
    "artifacts": {
      "type": "array",
      "minItems": 1,
      "items": {
        "type": "object",
        "additionalProperties": false,
        "required": [
          "path",
          "contentType",
          "purpose",
          "sampleDataFields",
          "referencePaths"
        ],
        "properties": {
          "path": {
            "type": "string",
            "minLength": 1
          },
          "contentType": {
            "enum": [
              "analyticRule",
              "huntingQuery",
              "workbook"
            ]
          },
          "purpose": {
            "type": "string",
            "minLength": 1
          },
          "sampleDataFields": {
            "type": "array",
            "items": {
              "type": "string",
              "minLength": 1
            },
            "uniqueItems": true
          },
          "referencePaths": {
            "type": "array",
            "minItems": 1,
            "items": {
              "type": "string",
              "pattern": "^Solutions/.+"
            },
            "uniqueItems": true
          }
        }
      }
    }
  }
}